Agency_Name,Website,API_Info,RSS_Feeds
Federal Accounting Standards Advisory Board (FASAB),http://www.fasab.gov/,,
Federal Aviation Administration (FAA),https://www.faa.gov/,Link to https://www.faa.gov/aircraft/draft_docs/,
Federal Bureau of Investigation (FBI),https://www.fbi.gov,,
Federal Committee on Statistical Methodology (FCSM),https://www.fcsm.gov/,,
Federal Communications Commission (FCC),https://www.fcc.gov/,"Link to https://docs.fcc.gov/public/attachments/DOC-409412A1.pdf, Link to https://docs.fcc.gov/public/attachments/DOC-409414A1.txt, Link to https://docs.fcc.gov/public/attachments/DOC-409404A1.txt, Link to https://docs.fcc.gov/public/attachments/DOC-409404A1.pdf, Link to /edocs, Link to https://docs.fcc.gov/public/attachments/DOC-409412A1.txt, Subpage found: https://www.fcc.gov/developers, Subpage found: https://www.fcc.gov/api, Link to https://docs.fcc.gov/public/attachments/DOC-409409A1.pdf, Link to https://docs.fcc.gov/public/attachments/DOC-409407A1.pdf, Link to /reports-research/developers, developers, Link to https://docs.fcc.gov/public/attachments/DOC-409407A1.txt, Subpage found: https://www.fcc.gov/documentation, Link to https://docs.fcc.gov/public/attachments/DOC-409409A1.txt, Link to https://docs.fcc.gov/public/attachments/DOC-409414A1.pdf",/news-events/rss-feeds-and-email-updates-fcc
Federal Consulting Group (FCG),https://www.doi.gov/node/43636/,,
Federal Deposit Insurance Corporation (FDIC),https://www.fdic.gov/,,
Federal Election Commission (FEC),https://www.fec.gov/,Link to https://api.open.fec.gov,
Federal Emergency Management Agency (FEMA),https://www.fema.gov/,,
Federal Energy Regulatory Commission (FERC),https://www.ferc.gov/,,
Federal Executive Boards (FEBs),https://www.feb.gov/,,
Federal Financial Institutions Examination Council (FFIEC),http://www.ffiec.gov/,,
Federal Financing Bank (FFB),http://www.treas.gov/ffb/,"Subpage found: http://www.treas.gov/ffb/developers, Subpage found: http://www.treas.gov/ffb/documentation, Subpage found: http://www.treas.gov/ffb/api",
Federal Geographic Data Committee (FGDC),http://www.fgdc.gov/,Subpage found: http://www.fgdc.gov/developers,
Federal Highway Administration (FHWA),https://highways.dot.gov/,,
Federal Housing Administration (FHA),https://www.hud.gov/federal_housing_administration,,
Federal Housing Finance Agency (FHFA),https://www.fhfa.gov/,Link to /data/developer-information,
Federal Judicial Center,https://www.fjc.gov/,,
Federal Labor Relations Authority (FLRA),http://www.flra.gov,,"mailto:EngagetheFLRA@flra.gov?subject=Feedback%20on%20FLRA.gov, /resources-training/training/customer-feedback, /feeds"
Federal Laboratory Consortium for Technology Transfer (FLC),https://federallabs.org/,"Link to https://federallabs.org/events/venture-capital-1-0-partnering-with-vcs-to-support-tech-entrepreneurs, Subpage found: https://federallabs.org/documentation, Subpage found: https://federallabs.org/api, Subpage found: https://federallabs.org/developers",
Federal Law Enforcement Training Centers (FLETC),https://www.fletc.gov/,Link to /national-capital-region-training-operations,
Federal Library and Information Network (FEDLINK),https://www.loc.gov/flicc/,,//www.loc.gov/rss/
Federal Maritime Commission (FMC),https://www.fmc.gov/,Subpage found: https://www.fmc.gov/documentation,
Federal Mediation and Conciliation Service (FMCS),http://www.fmcs.gov/,,
Federal Mine Safety and Health Review Commission,https://www.fmshrc.gov/,,
Federal Motor Carrier Safety Administration (FMCSA),https://www.fmcsa.dot.gov/,,
Federal Protective Service (FPS),https://www.dhs.gov/topic/federal-protective-service,,
Federal Railroad Administration (FRA),https://railroads.dot.gov/,,
Federal Register (OFR),https://www.archives.gov/federal-register,"Link to /founding-docs, Link to /founding-docs/",
Federal Reserve System,https://www.federalreserve.gov/,Link to https://www.federalreserve.gov/foia/capital-one-discover-application-materials.htm,/feeds/feeds.htm
Federal Retirement Thrift Investment Board (FRTIB),https://www.frtib.gov/,,
Federal Student Aid Information Center,https://studentaid.gov/,"Subpage found: https://studentaid.gov/api, Subpage found: https://studentaid.gov/documentation, Subpage found: https://studentaid.gov/developers",
Federal Trade Commission (FTC),https://www.ftc.gov/,"Subpage found: https://www.ftc.gov/api, Subpage found: https://www.ftc.gov/developers",/news-events/stay-connected#RSS
Federal Transit Administration (FTA),https://www.transit.dot.gov/,,
Federal Voting Assistance Program,https://www.fvap.gov/,"developers, Link to /xml-api","/portal/feedback?url=/, /xml-api"
Fire Administration (USFA),https://www.usfa.fema.gov/,,
Fish and Wildlife Service (FWS),https://www.fws.gov/,,
Fleet Forces Command (USFFC),https://www.usff.navy.mil/,,
"Food and Agriculture, National Institute of (NIFA)",http://www.nifa.usda.gov,,
Food and Drug Administration (FDA),https://www.fda.gov/,Link to /news-events/fda-voices/cder-brings-many-safe-and-effective-therapies-patients-and-consumers-2024,/about-fda/contact-fda/subscribe-podcasts-and-news-feeds
Food and Nutrition Service (FNS),https://www.fns.usda.gov/,,/rss-feeds
Food Safety and Inspection Service (FSIS),https://www.fsis.usda.gov/,"Link to /science-data/developer-resources/recall-api, Subpage found: https://www.fsis.usda.gov/api, Link to /science-data/developer-resources",/news-events/news-press-releases/news-feeds-subscriptions
Foreign Agricultural Service (FAS),https://www.fas.usda.gov/,,
Foreign Claims Settlement Commission (FCSC),https://www.justice.gov/fcsc,,
Forest Service,https://www.fs.usda.gov/,,
Fossil Energy (FECM),https://www.energy.gov/fe/office-fossil-energy,,
Freddie Mac,http://www.freddiemac.com,"Link to https://capitalmarkets.freddiemac.com, Link to http://capitalmarkets.freddiemac.com/capital-markets/",
Fulbright Program,https://eca.state.gov/fulbright,,"https://www.facebook.com/dialog/feed?app_id=116864361709382&link=https://eca.state.gov/?utm_source=ECA_PASC&utm_campaign=Creative_Campaign_2017&utm_medium=Web_Static_Banner&picture=https://eca.state.gov/files/bureau/eca_shareables/alabama_33183461981_o.png&name=Alabama&caption=Bureau of Educational and Cultural Affairs&description=This infographic shows the positive impact of ECA exchange programs in my state. Click through to share your state!&redirect_uri=https://eca.state.gov/?utm_source=ECA_PASC&utm_campaign=Creative_Campaign_2017&utm_medium=Web_Static_Banner&display=popup, /rss/newcontent"
General Services Administration (GSA),https://www.gsa.gov/,"Link to /about-us/gsa-regions/region-11-national-capital?topnav=about-us, Link to /buy-through-us/products-and-services/human-capital/human-capital-and-training-solutions?topnav=buy-through-us, Link to /buy-through-us/products-and-services/human-capital?topnav=buy-through-us",
Geological Survey (USGS),https://www.usgs.gov/,"Link to /products/web-tools/apis, Link to /human-capital",
Ginnie Mae,https://www.ginniemae.gov/pages/default.aspx,"Subpage found: https://www.ginniemae.gov/pages/default.aspx/developers, Subpage found: https://www.ginniemae.gov/pages/default.aspx/documentation, Subpage found: https://www.ginniemae.gov/pages/default.aspx/api",
Government Accountability Office (GAO),https://www.gao.gov/,,
"Government Ethics, Office of (OGE)",https://www.oge.gov/,"Link to /web/oge.nsf/accessdocs_summary-reports, Link to /web/oge.nsf/accessdocs_FOIA-guide, Link to /web/oge.nsf/accessdocs_FOIA-contacts, Link to /web/oge.nsf/section_landing_ethics-docs, Link to /web/oge.nsf/accessdocs_FOIA-landing, Link to /web/oge.nsf/accessdocs_compliance, Link to /web/oge.nsf/accessdocs_disclosure-faq, Link to /web/oge.nsf/accessdocs_FOIA-procedure#, Subpage found: https://www.oge.gov/api",/web/oge.nsf/OGE%20News%20feed
Government Publishing Office (GPO),https://www.gpo.gov/,"Link to /docs/default-source/news-content-pdf-files/2025/typeline_fall-2024_pueblo-five-questions.pdf, Link to /docs/default-source/promotions/testimonials_customerservices_2023_jm3.pdf, Link to https://www.gpo.gov/docs/default-source/mission-vision-and-goals-pdfs/gpo_strategicplan_fy23-27.pdf",
Harry S. Truman Scholarship Foundation,http://www.truman.gov/,,
Health Resources and Services Administration (HRSA),https://www.hrsa.gov/,,
Holocaust Memorial Museum,https://www.ushmm.org/,,
Hour and Wage Division (WHD),https://www.dol.gov/agencies/whd,,
House Office of Inspector General (OIG),https://www.house.gov/the-house-explained/officers-and-organizations/inspector-general,,
House Office of the Clerk,https://clerk.house.gov/,"Link to https://docs.house.gov/committee, Link to https://docs.house.gov/floor, Link to http://docs.house.gov/floor, Link to http://docs.house.gov/Committee",/xml/lists/MemberData.xml
Housing Office,https://www.hud.gov/program_offices/housing,,
Immigrant and Employee Rights Section (IER),https://www.justice.gov/crt/immigrant-and-employee-rights-section,,
Immigration and Customs Enforcement (ICE),https://www.ice.gov/,,/RSS
Indian Arts and Crafts Board (IACB),https://www.doi.gov/iacb/,,
Indian Health Service (IHS),http://www.ihs.gov/,,"/newsroom/directorsspeeches/, /feedbackform/"
Indo-Pacific Command (USINDOPACOM),https://www.pacom.mil/,,
Indoor Air Quality (IAQ),https://www.epa.gov/indoor-air-quality-iaq,,
Institute of Education Sciences (IES),http://www.ed.gov/about/offices/list/ies/index.html,,
Institute of Museum and Library Services (IMLS),https://www.imls.gov/,,
Inter-American Foundation (IAF),https://www.iaf.gov/,,
Interagency Alternative Dispute Resolution Working Group,https://adr.gov/,,
Interagency Committee for the Management of Noxious and Exotic Weeds,https://www.invasivespeciesinfo.gov/ficmnew,Link to https://www.ars.usda.gov/docs/quality-of-information/,https://www.invasivespeciesinfo.gov/whats-new/rss
Internal Revenue Service (IRS),https://www.irs.gov,,
International Development Finance Corporation (DFC),https://www.dfc.gov,,
International Trade Administration (ITA),https://www.trade.gov/,Link to /selectusa-find-economic-developers,
International Trade Commission (USITC),https://www.usitc.gov/,,
Interpol,https://www.justice.gov/interpol-washington,,
James Madison Memorial Fellowship Foundation,https://www.jamesmadison.gov/,,
Japan-United States Friendship Commission (JUSFC),https://www.jusfc.gov/,"Subpage found: https://www.jusfc.gov/documentation, Subpage found: https://www.jusfc.gov/developers",
Job Corps,https://www.jobcorps.gov,,
John F. Kennedy Center for the Performing Arts,https://www.kennedy-center.org/,,
Joint Board for the Enrollment of Actuaries,https://www.irs.gov/tax-professionals/enrolled-actuaries/information-about-the-joint-board,,
Joint Chiefs of Staff,https://www.jcs.mil/,Link to https://www.defense.gov/News/News-Stories/Article/Article/3931515/us-allies-focus-on-partnerships-in-iceland-amid-rapid-change-in-region/,
Joint Congressional Committee on Inaugural Ceremonies (JCCIC),https://www.inaugural.senate.gov/,,
Joint Fire Science Program (JFSP),https://www.firescience.gov/,,
Joint Forces Staff College (JFSC),https://jfsc.ndu.edu/,,
"Joint Program Executive Office for Chemical, Biological, Radiological and Nuclear Defense (JPEO-CBRND)",https://www.jpeocbrnd.osd.mil/,,
Judicial Panel on Multidistrict Litigation (JPML),http://www.jpml.uscourts.gov,,
"Justice Programs, Office of (OJP)",https://ojp.gov/,,
"Juvenile Justice and Delinquency Prevention, Office of (OJJDP)",http://www.ojjdp.gov/index.html,,
Legal Services Corporation,https://www.lsc.gov/,Subpage found: https://www.lsc.gov/api,
Library of Congress,https://www.loc.gov/,Subpage found: https://www.loc.gov/api,
"Manufactured Housing Programs, Office of (OMHP)",https://www.hud.gov/program_offices/housing/mhs,,
Marine Corps,https://www.marines.mil/,,/rss
Marine Mammal Commission,http://www.mmc.gov/,,
Maritime Administration (MARAD),https://www.maritime.dot.gov/,,
Marshals Service (USMS),http://www.usdoj.gov/marshals/,,/rss.xml
Medicaid and CHIP Payment and Access Commission (MACPAC),https://www.macpac.gov/,,
Medicare Payment Advisory Commission (MedPAC),http://www.medpac.gov/,Link to https://www.medpac.gov/document/medpac-comment-on-cmss-advance-notice-of-methodological-changes-for-cy-2026-for-medicare-advantage-capitation-rates-and-part-c-and-d-payment-policies/,
Merit Systems Protection Board (MSPB),https://www.mspb.gov/,"Subpage found: https://www.mspb.gov/api, Subpage found: https://www.mspb.gov/developers, Subpage found: https://www.mspb.gov/documentation",
Migratory Bird Conservation Commission,https://www.fws.gov/program/land-acquisition-and-realty/migratory-bird-conservation-commission,,
Military Postal Service Agency (MPSA),https://www.hrc.army.mil/content/Military%20Postal%20Service%20Agency%20(MPSA),,
Millennium Challenge Corporation (MCC),https://www.mcc.gov/,"Link to /resources/docs/compact-implementation-guidance/, Link to /resources/docs/program-procurement-guidelines/","/resources/doc/report-2024-annual-report-xml/, /news-and-events/event/outreach-100724-feed-the-future-zambia-agbusiness/, /resources/rss-feeds"
Mine Safety and Health Administration (MSHA),https://www.msha.gov/,,
Minority Business Development Agency (MBDA),https://www.mbda.gov/,Link to /financial-resources/capital-readiness-program,https://www.mbda.gov/rss.xml
"Minority Health, Office of (OMH)",https://minorityhealth.hhs.gov/,,
Mint,https://www.usmint.gov,,
Missile Defense Agency (MDA),https://www.mda.mil/,,
Mississippi River Commission (MRC),https://www.mvd.usace.army.mil/About/Mississippi-River-Commission-MRC/,"Subpage found: https://www.mvd.usace.army.mil/About/Mississippi-River-Commission-MRC/developers, Subpage found: https://www.mvd.usace.army.mil/About/Mississippi-River-Commission-MRC/documentation",https://www.mvd.usace.army.mil/Contact/RSS/
National Aeronautics and Space Administration (NASA),https://www.nasa.gov/,Subpage found: https://www.nasa.gov/api,
National Agricultural Statistics Service (NASS),https://www.nass.usda.gov,"Link to /developer/index.php, Link to https://quickstats.nass.usda.gov/api, developers, Link to https://www.ocio.usda.gov/sites/default/files/docs/2012/DR%204300-010%20Civil%20Rights%20Accountability%20and%20Procedures-Final_20170103.pdf","/Feedback/index.php, /Help/RSS/index.php"
National Cancer Institute (NCI),https://www.cancer.gov/,Link to /news-events/press-releases/2025/gene-therapy-hpv-respiratory-papillomatosis,
National Capital Planning Commission (NCPC),http://www.ncpc.gov/,Link to /plans/capitalspace/,
National Cemetery Administration (NCA),http://www.cem.va.gov/,"Subpage found: http://www.cem.va.gov/api, Link to https://www.va.gov/op3/docs/StrategicPlanning/VA2014-2020strategicPlan.pdf, Subpage found: http://www.cem.va.gov/documentation, Subpage found: http://www.cem.va.gov/developers",
National Center for Complementary and Integrative Health (NCCIH),https://www.nccih.nih.gov/,,
National Constitution Center,https://constitutioncenter.org/,,
National Council on Disability (NCD),https://ncd.gov/,,"/feedback/, /sitemap.xml, /feedback"
National Credit Union Administration (NCUA),https://www.ncua.gov/,,/contact-us/website-feedback
National Defense University (NDU),http://www.ndu.edu/,Link to https://docs.google.com/forms/d/e/1FAIpQLSdYYLOM05LFr9U1L-bJqMZ9JzN459vh7AKcz2NmUjdZoN4wxg/viewform,
National Endowment for the Arts (NEA),https://www.arts.gov/,,
National Endowment for the Humanities (NEH),http://www.neh.gov,,
National Flood Insurance Program (NFIP),https://www.floodsmart.gov/,,
National Gallery of Art,http://www.nga.gov/,,
National Geospatial-Intelligence Agency (NGA),http://www.nga.mil/,,
National Guard,https://www.nationalguard.mil/,,https://www.nationalguard.mil/News/RSS-Feeds/
National Health Information Center (NHIC),https://health.gov/our-work/health-literacy/resources/national-health-information-center,"developers, Link to /our-work/national-health-initiatives/health-literacy/consumer-health-content/free-web-content/apis-developers",
"National Heart, Lung, and Blood Institute (NHLBI)",https://www.nhlbi.nih.gov/,,
National Highway Traffic Safety Administration (NHTSA),https://www.nhtsa.gov,,
National Indian Gaming Commission,https://www.nigc.gov/,Link to /compliance/regional-offices#rapid,
National Institute for Occupational Safety and Health (NIOSH),https://www.cdc.gov/niosh/,"Link to /niosh/docs/2025-101/default.html, Link to /niosh/docs/2025-104/default.html",https://www.cdc.gov/rss
National Institute of Allergy and Infectious Diseases (NIAID),http://www.niaid.nih.gov,"Subpage found: http://www.niaid.nih.gov/developers, Subpage found: http://www.niaid.nih.gov/api, Subpage found: http://www.niaid.nih.gov/documentation",
National Institute of Corrections (NIC),https://nicic.gov/,,
National Institute of Deafness and Other Communication Disorders (NIDCD),https://www.nidcd.nih.gov/,,
National Institute of Diabetes and Digestive and Kidney Diseases (NIDDK),https://www.niddk.nih.gov/,,
National Institute of Justice (NIJ),https://nij.ojp.gov/,,
National Institute of Mental Health (NIMH),https://www.nimh.nih.gov/,,
National Institute of Neurological Disorders and Stroke (NINDS),https://www.ninds.nih.gov/,,https://www.linkedin.com/company/national-institute-of-neurological-disorders-and-stroke-ninds/posts/?feedView=all
National Institute of Standards and Technology (NIST),https://www.nist.gov/,,"/form/nist-gov-feedback?destination=/national-institute-standards-and-technology,  https://www.nist.gov/news-events/nist-rss-feeds"
National Institutes of Health (NIH),https://www.nih.gov/,,
National Interagency Fire Center (NIFC),https://www.nifc.gov/,,
National Invasive Species Information Center (NISIC),https://www.invasivespeciesinfo.gov/,Link to https://www.ars.usda.gov/docs/quality-of-information/,"https://www.invasivespeciesinfo.gov/whats-new/rss, /sciencedaily-news-feed-invasive-species"
National Labor Relations Board (NLRB),https://www.nlrb.gov/,,
National Laboratories,https://www.energy.gov/national-laboratories,,
National Library of Medicine,https://www.nlm.nih.gov/,,
National Marine Fisheries Service,https://www.nmfs.noaa.gov/,,
National Mediation Board (NMB),https://nmb.gov/NMB_Application/,,
National Nuclear Security Administration (NNSA),https://www.energy.gov/nnsa/national-nuclear-security-administration,,https://www.linkedin.com/company/national-nuclear-security-administration/posts/?feedView=articles
National Ocean Service,https://oceanservice.noaa.gov/,"Subpage found: https://oceanservice.noaa.gov/api, Subpage found: https://oceanservice.noaa.gov/developers, Subpage found: https://oceanservice.noaa.gov/documentation",/contact.html#feedback
National Oceanic and Atmospheric Administration (NOAA),https://www.noaa.gov/,,
National Park Foundation (NPF),http://www.nationalparks.org/,,
National Park Service (NPS),https://www.nps.gov/index.htm,Link to /subjects/aapiheritage/index.htm,
National Pesticide Information Center (NPIC),http://npic.orst.edu,,
National Prevention Information Network (NPIN),https://npin.cdc.gov/,,https://tools.cdc.gov/podcasts/rss.asp
National Reconnaissance Office (NRO),https://www.nro.gov/,,
National Science Foundation (NSF),http://www.nsf.gov/,"Link to /funding/postdocs, Subpage found: http://www.nsf.gov/developers",https://nsf.gov/rss
National Security Agency (NSA),http://www.nsa.gov/,,/DesktopModules/ArticleCS/RSS.ashx?ContentType=1&Site=1282&max=20
National Security Council (NSC),https://www.whitehouse.gov/nsc/,,
National Technical Information Service (NTIS),https://www.ntis.gov/,,
National Telecommunications and Information Administration (NTIA),http://www.ntia.doc.gov/,,
National Transportation Safety Board (NTSB),https://www.ntsb.gov/Pages/default.aspx,"Subpage found: https://www.ntsb.gov/Pages/default.aspx/documentation, Subpage found: https://www.ntsb.gov/Pages/default.aspx/api, Subpage found: https://www.ntsb.gov/Pages/default.aspx/developers",
National Weather Service,http://www.nws.noaa.gov/,,/rss_page.php?site_name=nws
Natural Resources Conservation Service (NRCS),https://www.nrcs.usda.gov/,,
"Natural Resources Revenue, Office of (ONRR)",https://onrr.gov/,"Subpage found: https://onrr.gov/api, Subpage found: https://onrr.gov/developers",
Navy,https://www.navy.mil/,,https://www.navy.mil/Resources/RSS-Feeds/
Northern Border Regional Commission,https://www.nbrc.gov/,,
Northern Command (USNORTHCOM),https://www.northcom.mil/,,
"Nuclear Energy, Office of",https://www.energy.gov/ne/office-nuclear-energy,,
Nuclear Regulatory Commission (NRC),http://www.nrc.gov/,,
Nuclear Waste Technical Review Board (NWTRB),http://www.nwtrb.gov/,,
Oak Ridge National Laboratory (ORNL),https://www.ornl.gov/,,
Occupational Safety and Health Administration (OSHA),https://www.osha.gov/,,
Occupational Safety and Health Review Commission (OSHRC),http://www.oshrc.gov/index.html,"Link to /assets/1/18/Burlington_Capital_PM_Group^20-0528^Commission_Remand_Order_12-31-2020final.pdf?11421, Subpage found: http://www.oshrc.gov/index.html/documentation, Link to /assets/1/18/17-1120_Earth_Developers_Inc.pdf?7382, Subpage found: http://www.oshrc.gov/index.html/api, developers, Subpage found: http://www.oshrc.gov/index.html/developers",
Office of Cuba Broadcasting (Radio y TV Martí),https://www.usagm.gov/networks/ocb/,,https://www.radiotelevisionmarti.com/rssfeeds
Office of Energy Efficiency and Renewable Energy (EERE),https://www.energy.gov/eere/office-energy-efficiency-renewable-energy,,
Office of English Language Acquisition,https://www2.ed.gov/about/offices/list/oela/index.html?src=oc,"Subpage found: https://www2.ed.gov/about/offices/list/oela/index.html?src=oc/api, Subpage found: https://www2.ed.gov/about/offices/list/oela/index.html?src=oc/documentation, Subpage found: https://www2.ed.gov/about/offices/list/oela/index.html?src=oc/developers",
Office of Investor Education and Advocacy (OIEA),https://www.investor.gov/,Link to https://www.sec.gov/education/capitalraising,
Office of Lead Hazard Control and Healthy Homes (OLHCHH),https://www.hud.gov/program_offices/healthy_homes,,
Office of Local Defense Community Cooperation,https://oldcc.gov/,,
Office of Management and Budget (OMB),https://www.whitehouse.gov/omb/,,
Office of Multifamily Housing Programs (MFH),https://www.hud.gov/program_offices/housing/mfh,Link to https://www.hud.gov/program_offices/housing/mfh/recapitalization,
Office of National Drug Control Policy (ONDCP),http://www.whitehouse.gov/ondcp,,
Office of Personnel Management (OPM),https://www.opm.gov/,"Link to /policy-data-oversight/human-capital-management/, Link to /policy-data-oversight/human-capital-framework/, Link to /services-for-agencies/human-capital-industry-solutions/, Link to /policy-data-oversight/chief-human-capital-officers-council/, Link to /policy-data-oversight/fy-2023-human-capital-reviews/, Subpage found: https://www.opm.gov/developers",
Office of Policy Development and Research (PD&R),https://www.huduser.gov/portal/home.html,,
Office of Postsecondary Education (OPE),http://www2.ed.gov/about/offices/list/ope/index.html,Link to /search?search_api_fulltext=,
Office of Refugee Resettlement (ORR),https://www.acf.hhs.gov/orr,,
Office of Science and Technology Policy (OSTP),https://www.whitehouse.gov/ostp/,,
Office of Scientific and Technical Information (OSTI),http://www.osti.gov/,Link to /persistent-identifier-services-developer-tools,
Office of Servicemember Affairs,https://www.consumerfinance.gov/consumer-tools/educator-tools/servicemembers/,Link to https://www.youtube.com/embed/OyLKd0Dnb6E?enablejsapi=1&origin=https://www.consumerfinance.gov,
Office of Special Counsel (OSC),https://osc.gov/,,
Office of Special Education and Rehabilitative Services (OSERS),http://www.ed.gov/about/offices/list/osers/index.html,,
"Office of Surface Mining, Reclamation and Enforcement (OSMRE)",http://www.osmre.gov/,Link to https://odocs.osmre.gov/,
Office of Textiles and Apparel (OTEXA),https://trade.gov/otexa,Link to /selectusa-find-economic-developers,
Office of the Assistant Secretary for Research and Technology,https://www.transportation.gov/mission/administrations/administration,,
Office of the Pardon Attorney,https://www.justice.gov/pardon,Link to https://www.whitehouse.gov/presidential-actions/2025/01/granting-pardons-and-commutation-of-sentences-for-certain-offenses-relating-to-the-events-at-or-near-the-united-states-capitol-on-january-6-2021/,
Office of Weights and Measures (OWM),https://www.nist.gov/pml/weights-and-measures,," https://www.nist.gov/news-events/nist-rss-feeds, /form/nist-gov-feedback?destination=/pml/owm"
Office on Violence Against Women (OVW),https://www.justice.gov/ovw,,
Open World Leadership Center,https://www.openworld.gov/,,
Parole Commission,https://www.justice.gov/uspc,,
Patent and Trademark Office (USPTO),https://www.uspto.gov/,,/learning-and-resources/xml-resources
Peace Corps,https://www.peacecorps.gov/,,
Pension Benefit Guaranty Corporation (PBGC),https://www.pbgc.gov/,,
Pentagon Force Protection Agency (PFPA),https://www.pfpa.mil/,,
Pipeline and Hazardous Materials Safety Administration (PHMSA),http://www.phmsa.dot.gov/,,
Postal Inspection Service,https://postalinspectors.uspis.gov/,,
Postal Regulatory Commission,http://www.prc.gov,,
Postal Service (USPS),https://www.usps.com/,"Subpage found: https://www.usps.com/developers, developers, Link to https://www.usps.com/business/web-tools-apis/",
"President's Council on Fitness, Sports and Nutrition (PCSFN)",https://health.gov/our-work/nutrition-physical-activity/presidents-council,,
Presidio Trust,http://www.presidio.gov,"Subpage found: http://www.presidio.gov/api, Subpage found: http://www.presidio.gov/developers, Subpage found: http://www.presidio.gov/documentation",https://presidio.gov/visit/contact-feedback/
Pretrial Services Agency for the District of Columbia,https://www.psa.gov/,,/?q=contact/feedback
Privacy and Civil Liberties Oversight Board (PCLOB),https://www.pclob.gov/,,
Public and Indian Housing (PIH),https://www.hud.gov/program_offices/public_indian_housing,,
