Agency_Name,Website,API_Info,RSS_Feeds
Radio Free Asia (RFA),http://www.rfa.org/,,
Radio Free Europe and Radio Liberty (RFE/RL),http://www.rferl.org/,,/rssfeeds
Railroad Retirement Board (RRB),https://rrb.gov/,,/contact/rrb_website_feedback
Rehabilitation Services Administration (RSA),https://rsa.ed.gov/,,
Risk Management Agency (RMA),http://www.rma.usda.gov/,,https://www.usda.gov/about-usda/policies-and-links/digital/rss-feeds
Rural Business-Cooperative Service,https://www.rd.usda.gov/about-rd/agencies/rural-business-cooperative-service,,
Rural Development,https://www.rd.usda.gov/,,
Rural Housing Service,https://www.rd.usda.gov/about-rd/agencies/rural-housing-service,,
Rural Utilities Service (RUS),https://www.rd.usda.gov/about-rd/agencies/rural-utilities-service,,
Saint Lawrence Seaway Development Corporation (GLS),http://www.seaway.dot.gov/,,
Secret Service,https://www.secretservice.gov/,,
Securities and Exchange Commission (SEC),https://www.sec.gov/,Link to https://www.sec.gov/developer,
Selective Service System (SSS),https://www.sss.gov/,,
Sentencing Commission,https://www.ussc.gov/,,/about/rss-frequently-asked-questions
Small Business Administration (SBA),http://www.sba.gov/,"Link to /funding-programs/investment-capital/sbic-directory, Link to /funding-programs/investment-capital",
Smithsonian Institution,http://www.si.edu/,,
Social Security Administration (SSA),http://www.ssa.gov/,"authentication, Subpage found: http://www.ssa.gov/developers",
Social Security Advisory Board (SSAB),https://www.ssab.gov/,,
Southeastern Power Administration,https://www.energy.gov/sepa/southeastern-power-administration,,
Southern Command (SOUTHCOM),http://www.southcom.mil,,
Southwestern Power Administration,https://www.energy.gov/swpa/southwestern-power-administration,,
Space Command,https://www.spacecom.mil/,,
Special Operations Command,https://www.socom.mil/,,
State Justice Institute (SJI),https://www.sji.gov/,,
Stennis Center for Public Service,http://www.stennis.gov/,Link to https://stennis.gov/student-programs/scholars-day-on-capitol-hill/,
Strategic Command (USSTRATCOM),http://www.stratcom.mil,,
Substance Abuse and Mental Health Services Administration (SAMHSA),https://www.samhsa.gov/,"Link to /substance-use/learn/tobacco-vaping/synar/faqs, Link to /substance-use/learn/tobacco-vaping, Link to /substance-use/learn/tobacco-vaping/synar/synars-success, Link to /substance-use/learn/tobacco-vaping/synar/annual-reports, Link to /substance-use/learn/tobacco-vaping/synar, Link to /substance-use/learn/tobacco-vaping/synar/requirements","/technical-assistance/brss-tacs/peer-support-workers, /technical-assistance/brss-tacs, /technical-assistance/brss-tacs/video-trainings, /technical-assistance/brss-tacs/youth, /technical-assistance/brss-tacs/decision-making, /technical-assistance/brss-tacs/parents-families, /technical-assistance/brss-tacs/peer-support-workers/core-competencies, /technical-assistance/brss-tacs/peer-support-workers/core-competencies-faq, /technical-assistance/brss-tacs/share-your-story, /about/laws-regulations-policies/website/rss-feed"
Supreme Court of the United States,http://www.supremecourtus.gov/,"Subpage found: http://www.supremecourtus.gov/api, Subpage found: http://www.supremecourtus.gov/developers, Subpage found: http://www.supremecourtus.gov/documentation",
Surface Transportation Board (STB),https://www.stb.gov/,,
Susquehanna River Basin Commission (SRBC),http://www.srbc.net/,,
Tax Court,http://www.ustaxcourt.gov/,,
Tennessee Valley Authority,https://www.tva.com/,,
Trade and Development Agency (USTDA),http://www.ustda.gov/,Link to https://www.ustda.gov/ustda-developer-application-programming-interfaces-apis/,
Trade Representative,http://www.ustr.gov/,"Link to /about-us/policy-offices/press-office/press-releases/2024/august/united-states-announces-successful-resolution-rapid-response-labor-mechanism-matter-volkswagen-de, Link to /about-us/office-human-capital-and-services/careers/student-internship-program",
Transportation Security Administration (TSA),https://www.tsa.gov,,
Trustee Program,https://www.justice.gov/ust,,
"U.S. Military Academy, West Point",https://www.westpoint.edu/,,
U.S. Mission to the United Nations (USUN),https://usun.usmission.gov/,,
U.S. Transportation Command (USTRANSCOM),https://www.ustranscom.mil/,,
Udall Foundation,http://www.udall.gov/,"Subpage found: http://www.udall.gov/api, Subpage found: http://www.udall.gov/developers, Subpage found: http://www.udall.gov/documentation",
Under Secretary for Political Affairs,http://www.state.gov/p/,,
Under Secretary for Public Diplomacy and Public Affairs,https://www.state.gov/bureaus-offices/under-secretary-for-public-diplomacy-and-public-affairs/,,
Unified Combatant Commands,https://www.defense.gov/About/Combatant-Commands/,"Subpage found: https://www.defense.gov/About/Combatant-Commands/developers, Subpage found: https://www.defense.gov/About/Combatant-Commands/documentation, Subpage found: https://www.defense.gov/About/Combatant-Commands/api",
Uniformed Services University of the Health Sciences (USU),https://www.usuhs.edu/,"Link to https://medschool.usuhs.edu/academics/national-capital-consortium, Link to http://news.usuhs.edu/2025/01/usu-professor-is-shaping-future-of.html",
United States Institute of Peace (USIP),http://www.usip.org/,,
United States Interagency Council on Homelessness (USICH),https://www.usich.gov/,,/news-events/news/feed
Veterans Benefits Administration (VBA),http://www.benefits.va.gov/,"Subpage found: http://www.benefits.va.gov/developers, Subpage found: http://www.benefits.va.gov/api, Subpage found: http://www.benefits.va.gov/documentation",
Veterans Health Administration (VHA),http://www.va.gov/health,"Link to https://www.va.gov/health/docs/vha-annual-report-2024.pdf, Link to /health/docs/vha-annual-report-2024.pdf, Link to https://www.va.gov/op3/docs/StrategicPlanning/VA2014-2020strategicPlan.pdf, Link to https://www.publichealth.va.gov/docs/flu_selfassess_flowchart.pdf",https://news.va.gov/category/inside-veterans-health/feed/
Veterans' Employment and Training Service (VETS),https://www.dol.gov/agencies/vets,,
Voice of America (VOA),https://www.insidevoa.com,"Link to https://docs.voanews.eu/en-us-inside/2024/10/16/e3e36f21-e5b1-42f6-a21a-8304c86a547d.pdf, Link to https://docs.voanews.eu/en-US-INSIDE/2023/07/11/01000000-0a00-0242-22ff-08db8241a6ca.pdf, Link to https://docs.voanews.eu/en-US-INSIDE/2024/04/01/01000000-0aff-0242-e3cf-08dc5265779f.pdf, Link to https://docs.voanews.eu/en-us-inside/2025/01/08/d1f60030-6061-4f2f-bf64-b11db5000d34.pdf, Link to https://docs.voanews.eu/en-us-inside/2024/10/11/5e5e2926-ae45-4547-a71e-943b0234cd04.pdf, Link to https://docs.google.com/forms/d/e/1FAIpQLSceBUoJvZdZJhGvFpjbYxSj5uR0mrEhcVD4e1r86JgDg5XyIQ/viewform?vc=0&c=0&w=1, Link to https://docs.voanews.eu/en-US-INSIDE/2024/02/28/01000000-0aff-0242-829f-08dc38798254.pdf, Link to https://docs.voanews.eu/en-US-INSIDE/2024/02/28/01000000-c0a8-0242-b62d-08dc38855964.pdf, Link to https://docs.voanews.eu/en-US-INSIDE/2024/02/29/01000000-c0a8-0242-1f98-08dc396b3478.pdf, Link to https://docs.voanews.eu/en-US-INSIDE/2024/02/28/01000000-c0a8-0242-1fd9-08dc38855655.pdf, Link to https://docs.voanews.eu/en-US-INSIDE/2024/02/28/01000000-0aff-0242-2f00-08dc3885609d.pdf",
Washington Headquarters Services (WHS),https://www.whs.mil/,,
Western Area Power Administration (WAPA),https://www.wapa.gov,,
White House,http://www.whitehouse.gov/,,
Wireless Telecommunications Bureau (WTB),https://www.fcc.gov/wireless-telecommunications,"Subpage found: https://www.fcc.gov/wireless-telecommunications/api, Subpage found: https://www.fcc.gov/wireless-telecommunications/developers, Link to /edocs, Subpage found: https://www.fcc.gov/wireless-telecommunications/documentation, Link to /reports-research/developers, developers",/news-events/rss-feeds-and-email-updates-fcc
Women's Bureau,https://www.dol.gov/agencies/wb,,
Woodrow Wilson International Center for Scholars,http://www.wilsoncenter.org,,
