Agency_Name,Website,API_Info,RSS_Feeds
AbilityOne Commission,https://www.abilityone.gov/,,documents/UPDATED DRAFT Commission Policy 51.405 for Public Feedback 7Jan2025 1612-a.docx
Access Board,https://www.access-board.gov/,,
Administration for Children and Families (ACF),https://www.acf.hhs.gov/,,
Administration for Community Living (ACL),https://acl.gov/,,
Administration for Native Americans (ANA),https://www.acf.hhs.gov/ana,,
Administrative Conference of the United States (ACUS),https://www.acus.gov/,,
Administrative Office of the U.S. Courts,https://www.uscourts.gov/,,
Advisory Council on Historic Preservation (ACHP),https://www.achp.gov/,,/contact/feedback
Africa Command,https://www.africom.mil/,"Subpage found: https://www.africom.mil/api, Subpage found: https://www.africom.mil/developers, Subpage found: https://www.africom.mil/documentation",/command-feedback
African Development Foundation (USADF),https://www.usadf.gov/,,
Agency for Global Media,https://www.usagm.gov/,,
Agency for Healthcare Research and Quality (AHRQ),https://www.ahrq.gov/,"Link to /programs/index.html?search_api_views_fulltext=&field_program_topics=14172, Link to /tools/index.html?search_api_views_fulltext=&field_toolkit_topics=14169&sort_by=title&sort_order=ASC, Link to /tools/index.html?search_api_views_fulltext=&field_toolkit_topics=14167&sort_by=title&sort_order=ASC, Link to /programs/index.html?search_api_views_fulltext=&field_program_topics=14171, Link to /tools/index.html?search_api_views_fulltext=&field_toolkit_topics=14168&sort_by=title&sort_order=ASC, Link to /tools/index.html?search_api_views_fulltext=&field_toolkit_topics=14166&sort_by=title&sort_order=ASC, Link to /programs/index.html?search_api_views_fulltext=&field_program_topics=14208, Link to /tools/index.html?search_api_views_fulltext=&field_toolkit_topics=14170&sort_by=title&sort_order=ASC, Link to /programs/index.html?search_api_views_fulltext=&field_program_topics=14175, Link to /programs/index.html?search_api_views_fulltext=&field_program_topics=14173, Link to /programs/index.html?search_api_views_fulltext=&field_program_topics=14177, Link to /programs/index.html?search_api_views_fulltext=&field_program_topics=14174, Link to /programs/index.html?search_api_views_fulltext=&field_program_topics=14176",
Agency for International Development (USAID),http://www.usaid.gov/,"Subpage found: http://www.usaid.gov/documentation, Subpage found: http://www.usaid.gov/api, Subpage found: http://www.usaid.gov/developers",
Agency for Toxic Substances and Disease Registry (ATSDR),https://www.atsdr.cdc.gov/,,https://www.cdc.gov/rss
Agricultural Marketing Service (AMS),https://www.ams.usda.gov/,,https://www.usda.gov/about-usda/policies-and-links/digital/rss-feeds
Agricultural Research Service (ARS),https://www.ars.usda.gov/,"Link to /docs/quality-of-information/, Link to /docs/headquarters-information/",
Agriculture Department (USDA),https://www.usda.gov/,"Subpage found: https://www.usda.gov/developers, Subpage found: https://www.usda.gov/api","mailto:feedback@oc.usda.gov, /rss-feeds"
Agriculture Library (NAL),https://www.nal.usda.gov/,Link to https://www.ars.usda.gov/docs/quality-of-information/,/services/data-management-planning#toc-dmp-feedback-and-review
Air Force,https://www.af.mil/,,"https://www.af.mil/DesktopModules/ArticleCS/RSS.ashx?ContentType=1&Site=1&Category=22363%2c24081%2c24397%2c22751%2c23106%2c24385%2c22077%2c22518%2c20214&isdashboardselected=0&max=20, /RSS, https://www.af.mil/DesktopModules/ArticleCS/RSS.ashx?ContentType=1&Site=1&Category=23105%2c16032&isdashboardselected=0&max=20, https://www.af.mil/DesktopModules/ArticleCS/RSS.ashx?ContentType=1&Site=1&Category=14852&isdashboardselected=0&max=20"
Air Force Reserve,https://www.afrc.af.mil/,,
Alcohol and Tobacco Tax and Trade Bureau (TTB),https://www.ttb.gov,,/online-services/rss/rss-feeds-from-ttb
"Alcohol, Tobacco, Firearms and Explosives Bureau (ATF)",https://www.atf.gov/,"Link to https://www.atf.gov/firearms/docs/open-letter/vermont-november-2024-open-letter-enactment-vermont-statute-13-vsa-%C2%A7-4019a/download , Link to /firearms/docs/report/2021-firearms-commerce-report/download, Link to https://www.atf.gov/firearms/docs/open-letter/vermont-november-2024-open-letter-enactment-vermont-statute-13-vsa-%C2%A7-4019a/download",
Alhurra TV,https://www.alhurra.com/,Link to /decision-capital,/rssfeeds
American Battle Monuments Commission (ABMC),https://www.abmc.gov/,,
AmeriCorps,https://americorps.gov/,Link to https://www.oge.gov/web/oge.nsf/section_landing_ethics-docs,
AmeriCorps Seniors,https://americorps.gov/serve/americorps-seniors,Link to https://www.oge.gov/web/oge.nsf/section_landing_ethics-docs,
Animal and Plant Health Inspection Service (APHIS),https://www.aphis.usda.gov/aphis/home/,,"/trade-feedback, /wildlife-feedback, /plant-feedback, /animal-welfare-feedback, /biotechnology-feedback, /animal-health-feedback"
Antitrust Division,https://www.justice.gov/atr,,/atr/news-feeds
Appalachian Regional Commission (ARC),https://www.arc.gov/,Link to https://www.arc.gov/access-to-capital-projects/,
Architect of the Capitol,https://www.aoc.gov/,"Link to https://www.aoc.gov/explore-capitol-campus/art, Link to https://x.com/uscapitol, Link to /explore-capitol-campus, Link to /explore-capitol-campus/blog, Link to /explore-capitol-campus/buildings-grounds, Link to https://www.aoc.gov/explore-capitol-campus/blog, Link to https://www.facebook.com/ArchitectoftheCapitol, Link to /explore-capitol-campus/visitor-resources, Link to https://www.flickr.com/photos/uscapitol, Link to https://instagram.com/uscapitol, Link to /explore-capitol-campus/capitol-hill-facts, Link to https://www.aoc.gov/explore-capitol-campus/buildings-grounds, Link to /explore-capitol-campus/blog/hallowed-figure-american-art-and-culture-bald-eagle, Link to https://www.visitthecapitol.gov, Link to /explore-capitol-campus/art",
"Archives, National Archives and Records Administration (NARA)",https://www.archives.gov/,"Link to /founding-docs, Subpage found: https://www.archives.gov/developers, Link to /founding-docs/",
Arctic Research Commission (USARC),https://www.arctic.gov/,,
Armed Forces Retirement Home (AFRH),http://www.afrh.gov/,,
Arms Control and International Security,https://www.state.gov/bureaus-offices/under-secretary-for-arms-control-and-international-security-affairs/,,
Army,https://www.army.mil/,Link to https://api.army.mil/e2/c/images/2025/02/13/8c46b75d/original.jpg,
Army Corps of Engineers,http://www.usace.army.mil/,,"https://www.usace.army.mil/DesktopModules/ArticleCS/RSS.ashx?ContentType=9&Site=420&Category=20166&isdashboardselected=0&max=20, https://www.usace.army.mil/Contact/RSS/"
"Arthritis, Musculoskeletal and Skin Diseases, National Institute of (NIAMS)",https://www.niams.nih.gov/,,
Bankruptcy Courts,https://www.uscourts.gov/services-forms/bankruptcy,,
Barry M. Goldwater Scholarship and Excellence in Education Foundation,https://goldwater.scholarsapply.org/,"Subpage found: https://goldwater.scholarsapply.org/documentation, Subpage found: https://goldwater.scholarsapply.org/api, Subpage found: https://goldwater.scholarsapply.org/developers",
Bonneville Power Administration (BPA),https://www.bpa.gov,"Link to /about/finance/capital-hydropower-improvement-projects, Link to /about/finance/capital-access",
Botanic Garden,http://www.usbg.gov/,,
Bureau of Consular Affairs,http://travel.state.gov/,"Subpage found: http://travel.state.gov/developers, authentication, Link to /content/travel/en/replace-certify-docs/requesting-a-record.html, Link to /content/travel/en/replace-certify-docs/authenticate-your-document.html, Subpage found: http://travel.state.gov/documentation, Subpage found: http://travel.state.gov/api, Link to /content/travel/en/replace-certify-docs.html",/content/travel/en/rss.html
Bureau of Consumer Financial Protection (CFPB),https://www.consumerfinance.gov/,,
Bureau of Economic Analysis (BEA),https://www.bea.gov/,"Link to /resources/developer-tools, Link to https://apps.bea.gov/API/signup/, Subpage found: https://www.bea.gov/developers, Link to /resources/for-developers, Subpage found: https://www.bea.gov/api, developers",https://apps.bea.gov/rss/rss.xml
Bureau of Engraving and Printing (BEP),https://www.moneyfactory.gov/,"Subpage found: https://www.moneyfactory.gov/documentation, Subpage found: https://www.moneyfactory.gov/developers, Subpage found: https://www.moneyfactory.gov/api","/sitemap.xml, /feedback"
Bureau of Indian Affairs (BIA),https://www.bia.gov/,,/sitemap.xml
Bureau of Industry and Security (BIS),https://www.bis.doc.gov/,"authentication, Subpage found: https://www.bis.doc.gov/documentation, Subpage found: https://www.bis.doc.gov/api, Subpage found: https://www.bis.doc.gov/developers",/rss.xml
Bureau of International Labor Affairs (ILAB),https://www.dol.gov/agencies/ilab,,
Bureau of Justice Statistics (BJS),https://www.bjs.gov/,"Subpage found: https://www.bjs.gov/developers, Subpage found: https://www.bjs.gov/api, Subpage found: https://www.bjs.gov/documentation, Link to https://bjs.ojp.gov/library/publications/capital-punishment-2022-statistical-tables",
Bureau of Labor Statistics (BLS),https://stats.bls.gov/,,
Bureau of Land Management (BLM),https://www.blm.gov/,,"/info/RSS-feeds, /feedback"
Bureau of Ocean Energy Management (BOEM),https://www.boem.gov/,,/webteam/rss/boem-rss.xml
Bureau of Prisons (FBOP),https://www.bop.gov/,,/website/feedback.jsp
Bureau of Reclamation,https://www.usbr.gov/,,
Bureau of Safety and Environmental Enforcement (BSEE),https://www.bsee.gov/,,/research/research-support-section-rss
Bureau of the Census,https://www.census.gov/,"Subpage found: https://www.census.gov/api, developers, Subpage found: https://www.census.gov/developers, Link to https://www.census.gov/developers/",
Bureau of the Fiscal Service,http://www.fiscal.treasury.gov,,https://www.treasurydirect.gov/rss/index.htm
Bureau of Transportation Statistics (BTS),https://www.bts.gov/,,
Capitol Police,https://www.uscp.gov/,"Link to http://www.uscp.gov/visiting-capitol-hill/regulations-prohibitions, Link to https://www.facebook.com/uscapitolpolice, Link to /visiting-capitol-hill/official-business/official-business-building-access-hours, Link to /visiting-capitol-hill/regulations-prohibitions, Link to mailto:USCapitolPolice@uscp.gov?subject=Web%20Mail&body=From%20USCP.gov, Link to /visiting-capitol-hill, Link to https://twitter.com/CapitolPolice, Link to https://www.visitthecapitol.gov/visit/book-a-tour, Link to /visiting-capitol-hill/visitor-information/getting-capitol-hill, Link to /visiting-capitol-hill/security-screening-visitors-disabilities-medical-conditions-medical-devices, Link to /visiting-capitol-hill/regulations-prohibitions/prohibited-items, Link to /news/public-information-reporting-capitol-hill, Link to http://www.uscp.gov/visiting-capitol-hill/regulations-prohibitions/prohibited-items, Link to /visiting-capitol-hill/official-business/law-enforcement-personnel, Link to /visiting-capitol-hill/activities-requiring-permits, Link to http://www.uscp.gov/visiting-capitol-hill",
Capitol Visitor Center,http://www.visitthecapitol.gov,"Link to https://shop.visitthecapitol.gov/, Link to /discover-capitol-symbols, Link to /capitol-conversations, Link to /live-virtual-capitol-tour, Link to /education-resource/discover-capitol-architecture, Link to https://shop.visitthecapitol.gov, Link to https://www.instagram.com/visitthecapitol, Link to https://www.facebook.com/USCapitol, Link to /explore/the-capitol, Link to https://www.youtube.com/user/visitthecapitol, Link to https://twitter.com/visitthecapitol",
"Career, Technical, and Adult Education, Office of (OCTAE)",https://www2.ed.gov/about/offices/list/ovae/index.html,,
Center for Food Safety and Applied Nutrition (CFSAN),https://www.fda.gov/about-fda/fda-organization/center-food-safety-and-applied-nutrition-cfsan,,/about-fda/contact-fda/subscribe-podcasts-and-news-feeds
Center for Nutrition Policy and Promotion (CNPP),https://www.fns.usda.gov/cnpp,,/rss-feeds
Center for Parent Information and Resources (CPIR),https://www.parentcenterhub.org/,Link to https://docs.google.com/document/d/1TfvHeE58oc32bRtO3fm4RkcW5mZYveIy/edit,"mailto:?subject=Facebook&body=https%3A%2F%2Fwww.facebook.com%2F34938844586%2Fposts%2F1044777954346700%20-%20%0A%0A%09%0A%09%09%23MilestoneMonday....%20Play%20is%20serious%20work%21%20How%20your%20child%20plays%20can%20offer%20important%20clues%20about%20their%20development.Encourage%20your%2018-month-old%E2%80%99s%20imagination%20by%20handing%20them%20a%20spoon%20and%20taking%20turns%20%E2%80%9Cfeeding%E2%80%9D%20their%20stuffed%20animals.%20Simple%20pretend%20play%20like%20this%20builds%20important%20skills%21Need%20more%20milestone-based%20activity%20ideas%3F%20Download%20the%20FREE%20CDC%20Milestones%20Tracker%20App%20to%20stay%20on%20top%20of%20your%20child%E2%80%99s%20growth%3A%20www.cdc.gov%2FMilestones%23ActEarly%20%23MilestonesMatter%20%23BeInformed%20%23ChildDevelopment%20%23Resources%09%09%09%0A%09, https://www.linkedin.com/shareArticle?mini=true&url=https%3A%2F%2Fwww.facebook.com%2F34938844586%2Fposts%2F1044777954346700&title=%09%09%09%23MilestoneMonday....%20Play%20is%20serious%20work%21%20How%20your%20child%20plays%20can%20offer%20important%20clues%20about%20their%20development.Encourage%20your%2018-month-old%E2%80%99s%20imagination%20by%20handing%20them%20a%20spoon%20and%20taking%20turns%20%E2%80%9Cfeeding%E2%80%9D%20their%20stuffed%20animals.%20Simple%20pretend%20play%20like%20this%20builds%20important%20skills%21Need%20more%20milestone-based%20activity%20ideas%3F%20Download%20the%20FREE%20CDC%20Milestones%20Tracker%20App%20to%20stay%20on%20top%20of%20your%20child%E2%80%99s%20growth%3A%20www.cdc.gov%2FMilestones%23ActEarly%20%23MilestonesMatter%20%23BeInformed%20%23ChildDevelopment%20%23Resources%09%09%09%09"
Centers for Disease Control and Prevention (CDC),https://www.cdc.gov/,,https://www.cdc.gov/rss
Centers for Medicare and Medicaid Services (CMS),https://www.cms.gov/,Link to https://developer.cms.gov/,https://www.cms.gov/Outreach-and-Education/Outreach/CMSFeeds/index
Central Command (CENTCOM),https://www.centcom.mil/,,
Central Intelligence Agency (CIA),https://www.cia.gov/,,
Chemical Safety Board (CSB),https://www.csb.gov/,,"/videos/video-feedback-form/, /media-room/rss-feeds/"
Chief Acquisition Officers Council (CAOC),https://www.acquisition.gov/cao-home,Link to /search/advanced?keys=&page=0&sort_by=search_api_relevance&sort_order=DESC&type%5Bfar_dita%5D=far_dita,
Chief Financial Officers Council (CFO),https://www.cfo.gov,,
Chief Human Capital Officers (CHCO) Council,https://www.chcoc.gov/,,
Chief Information Officers Council,https://www.cio.gov/,,/feed.xml
"Child Support Enforcement, Office of (OCSS)",https://www.acf.hhs.gov/css,,
Circuit Courts of Appeal,http://www.uscourts.gov/about-federal-courts,,
Citizens' Stamp Advisory Committee (CSAC),https://about.usps.com/who-we-are/csac/welcome.htm,,
Citizenship and Immigration Services (USCIS),http://www.uscis.gov,,
"Civil Rights Division, Department of Justice",https://www.justice.gov/crt,,
"Civil Rights, Department of Education Office of (OCR)",http://www.ed.gov/ocr,,
"Civil Rights, Department of Health and Human Services Office for",https://www.hhs.gov/ocr/index.html,,
Coast Guard (USCG),https://www.uscg.mil/,Link to https://www.uscg.mil/Mariners/National-Pollution-Funds-Center/NRD/NRD_DOCS/,
Commerce Department (DOC),https://www.commerce.gov/,"Link to /data-and-reports/developer-resources, Link to /data-and-reports/developer-resources/commercegov-api, Subpage found: https://www.commerce.gov/api, Link to /data-and-reports/developer-resources/bureau-apis, Link to /data-and-reports/developer-resources/data-tutorials","https://www.commerce.gov/rss.xml, /about/contact-us/site-feedback, /rss"
Commission of Fine Arts,http://www.cfa.gov/,,
Commission on Civil Rights (USCCR),http://www.usccr.gov,,/sitemap.xml
Commission on International Religious Freedom (USCIRF),http://www.uscirf.gov/,,
Commission on Presidential Scholars,http://www.ed.gov/programs/psp/commission.html?exp=0,"Subpage found: http://www.ed.gov/programs/psp/commission.html?exp=0/api, Subpage found: http://www.ed.gov/programs/psp/commission.html?exp=0/developers, Subpage found: http://www.ed.gov/programs/psp/commission.html?exp=0/documentation",
Commission on Security and Cooperation in Europe (Helsinki Commission),https://www.csce.gov,,
Committee on Foreign Investment in the United States (CFIUS),https://home.treasury.gov/policy-issues/international/the-committee-on-foreign-investment-in-the-united-states-cfius,"Link to /data/treasury-international-capital-tic-system, Link to /data/treasury-international-capital-tic-system-home-page/release-dates-of-tic-data-0, Link to https://search.usa.gov/search/docs?utf8=%E2%9C%93&affiliate=treas&sort_by=&dc=9121&query=media-advisories, Link to https://search.usa.gov/search/docs?utf8=%E2%9C%93&affiliate=treas&sort_by=&dc=9123&query=weekly-schedule-updates, Link to /data/treasury-international-capital-tic-system-home-page/tic-forms-instructions",https://www.treasury.gov/pages/tgovproblemsfeedbackform.aspx
Commodity Futures Trading Commission (CFTC),https://www.cftc.gov/,,http://www.cftc.gov/RSS/index.htm
Community Oriented Policing Services (COPS),https://cops.usdoj.gov/,,
Community Planning and Development (CPD),https://www.hud.gov/program_offices/comm_planning,,
"Comptroller of the Currency, Office of (OCC)",http://www.occ.gov/,"Link to /topics/supervision-and-examination/capital/index-capital.html, Link to /topics/supervision-and-examination/capital-markets/index-capital-markets.html",/rss/index-rss.html
Congress—U.S. House of Representatives,http://www.house.gov/,"Link to https://www.visitthecapitol.gov/, Link to http://docs.house.gov/Committee/Calendar/ByEvent.aspx?EventID=117885, Link to https://docs.house.gov/floor/",
Congress—U.S. Senate,https://www.senate.gov/,"Subpage found: https://www.senate.gov/developers, Link to https://www.visitthecapitol.gov/, Subpage found: https://www.senate.gov/api, Link to http://www.visitthecapitol.gov/, Link to /about/historic-buildings-spaces/capitol.htm, Subpage found: https://www.senate.gov/documentation",
Congressional Budget Office (CBO),https://www.cbo.gov/,,/publications/all/rss.xml
Congressional Research Service (CRS),https://www.loc.gov/crsinfo/about/,,//www.loc.gov/rss/
"Congressional Workplace Rights, Office of (OCWR)",https://www.ocwr.gov/,,
Consumer Product Safety Commission (CPSC),https://www.cpsc.gov/,Link to /Recalls/CPSC-Recalls-Application-Program-Interface-API-Information,/website-feedback
Coordinating Council on Juvenile Justice and Delinquency Prevention,https://juvenilecouncil.ojp.gov/,,
Copyright Office,https://www.copyright.gov/,,
Council of Economic Advisers (CEA),https://www.whitehouse.gov/cea,,
Council of the Inspectors General on Integrity and Efficiency (CIGIE),http://www.ignet.gov,,/sitemap.xml
Council on Environmental Quality (CEQ),https://www.whitehouse.gov/ceq/,,
Court of Appeals for the Armed Forces,https://www.armfor.uscourts.gov/newcaaf/home.htm,,"https://chrome.google.com/webstore/search/rss%20feed%20reader?hl=en-US&_category=extensions, https://microsoftedge.microsoft.com/addons/search/rss%20feed%20reader, http://www.armfor.uscourts.gov/newcaaf/RSS Feed/Notices/rss.xml, #rss"
Court of Appeals for the Federal Circuit,https://cafc.uscourts.gov/,,
Court of Appeals for Veterans Claims,http://www.uscourts.cavc.gov,,
Court of Federal Claims,http://www.uscfc.uscourts.gov/,,/rss.xml
Court of International Trade,http://www.cit.uscourts.gov/,,https://ecf.cit.uscourts.gov/cgi-bin/rss_outside.pl
Court Services and Offender Supervision Agency for the District of Columbia (CSOSA),https://www.csosa.gov,,
Customs and Border Protection (CBP),https://www.cbp.gov/,Link to /trade/basic-import-export/export-docs/motor-vehicle,
Cyber Command,https://www.cybercom.mil/,,
Cybersecurity and Infrastructure Security Agency (CISA),https://www.cisa.gov,,
Debt and Claims Management Center,https://www.dfas.mil/debtandclaims.html,,
Defense Advanced Research Projects Agency (DARPA),https://www.darpa.mil/,,"https://www.darpa.mil/rss.xml, /sitemap.xml"
Defense Commissary Agency,https://www.commissaries.com/,,
Defense Contract Audit Agency (DCAA),https://www.dcaa.mil,,
Defense Contract Management Agency (DCMA),https://www.dcma.mil/,,
Defense Counterintelligence and Security Agency (DCSA),https://www.dcsa.mil/,,
Defense Department (DOD),https://www.defense.gov/,,
Defense Finance and Accounting Service (DFAS),https://www.dfas.mil,,
Defense Health Agency (DHA),https://www.health.mil/dha,,
Defense Information Systems Agency (DISA),http://www.disa.mil/,"Subpage found: http://www.disa.mil/documentation, Subpage found: http://www.disa.mil/api, Subpage found: http://www.disa.mil/developers",
Defense Intelligence Agency (DIA),https://www.dia.mil/,,
Defense Logistics Agency (DLA),https://www.dla.mil/,,
Defense Nuclear Facilities Safety Board (DNFSB),https://www.dnfsb.gov/,,
Defense POW/MIA Accounting Agency (DPAA),https://www.dpaa.mil/,,
Defense Security Cooperation Agency (DSCA),https://www.dsca.mil/,,/dsca-rss-really-simple-syndication
Defense Technical Information Center (DTIC),https://discover.dtic.mil/,,
Defense Threat Reduction Agency (DTRA),https://www.dtra.mil,,
Delaware River Basin Commission (DRBC),http://www.state.nj.us/drbc/,,/drbc/rss.xml
Delta Regional Authority (DRA),https://dra.gov/,,
Denali Commission,https://www.denali.gov/,,
Department of Education (ED),https://www.ed.gov/,,
Department of Energy (DOE),https://www.energy.gov/,"Subpage found: https://www.energy.gov/developers, Subpage found: https://www.energy.gov/api",
Department of Energy’s Office of Science,https://www.energy.gov/science/office-science,,
Department of Health and Human Services (HHS),https://www.hhs.gov/,,
Department of Homeland Security (DHS),https://www.dhs.gov/,,
Department of Housing and Urban Development (HUD),https://www.hud.gov/,,
Department of Justice (DOJ),https://www.justice.gov/,Subpage found: https://www.justice.gov/developers,
Department of Labor (DOL),https://www.dol.gov/,Subpage found: https://www.dol.gov/developers,
Department of State (DOS),https://www.state.gov/,,
Department of the Interior (DOI),https://www.doi.gov/,,
Department of the Treasury,https://home.treasury.gov/,"Link to /data/treasury-international-capital-tic-system, Link to /data/treasury-international-capital-tic-system-home-page/release-dates-of-tic-data-0, Link to https://search.usa.gov/search/docs?utf8=%E2%9C%93&affiliate=treas&sort_by=&dc=9121&query=media-advisories, Link to https://search.usa.gov/search/docs?utf8=%E2%9C%93&affiliate=treas&sort_by=&dc=9123&query=weekly-schedule-updates, Link to /data/treasury-international-capital-tic-system-home-page/tic-forms-instructions",https://www.treasury.gov/pages/tgovproblemsfeedbackform.aspx
Department of Transportation (DOT),https://www.transportation.gov,,
Department of Veterans Affairs (VA),https://www.va.gov/,,
"Director of National Intelligence, Office of (ODNI)",https://www.dni.gov/,,
"Disability Employment Policy, Office of (ODEP)",https://www.dol.gov/agencies/odep,,
Drug Enforcement Administration (DEA),https://www.dea.gov/,,
Economic Development Administration (EDA),https://www.eda.gov/,,
"Economic Growth, Energy, and the Environment",https://www.state.gov/bureaus-offices/under-secretary-for-economic-growth-energy-and-the-environment/,,
Economic Research Service (ERS),https://www.ers.usda.gov/,"Subpage found: https://www.ers.usda.gov/developers, Subpage found: https://www.ers.usda.gov/api",/index/sitemap.xml
Elder Justice Initiative (EJI),https://www.justice.gov/elderjustice,,
Election Assistance Commission (EAC),http://www.eac.gov/,,/rss.xml
"Elementary and Secondary Education, Office of (OESE)",https://oese.ed.gov/,,
Employee Benefits Security Administration (EBSA),https://www.dol.gov/agencies/ebsa,,
Employment and Training Administration (ETA),https://www.doleta.gov/,"Subpage found: https://www.doleta.gov/documentation, Subpage found: https://www.doleta.gov/api, Subpage found: https://www.doleta.gov/developers, Link to https://oui.doleta.gov/unemploy/docs/factsheet/UI_Program_FactSheet.pdf",
Energy Information Administration (EIA),https://www.eia.gov/,"Subpage found: https://www.eia.gov/developers, Link to /beta/api/",/tools/rssfeeds/
"Environmental Management, Office of",https://www.energy.gov/em/office-environmental-management,,
Environmental Protection Agency (EPA),https://www.epa.gov/,Subpage found: https://www.epa.gov/developers,
Equal Employment Opportunity Commission (EEOC),https://www.eeoc.gov/,,"/rss/newsroom, https://www.eeoc.gov/rss/newsroom"
European Command (USEUCOM),https://www.eucom.mil,"Subpage found: https://www.eucom.mil/developers, Subpage found: https://www.eucom.mil/api, Subpage found: https://www.eucom.mil/documentation",/command-feedback
Executive Office for Immigration Review (EOIR),https://www.justice.gov/eoir,,
Export-Import Bank of the United States (EXIM),https://www.exim.gov,Link to /solutions/working-capital,
Fair Housing and Equal Opportunity (FHEO),https://www.hud.gov/program_offices/fair_housing_equal_opp,,
Fannie Mae,https://www.fanniemae.com/,"developer portal, Link to https://developer.fanniemae.com/#/home, Link to https://capitalmarkets.fanniemae.com/sustainable-bonds, Link to /about-us/investor-relations/capital-disclosures, Link to https://capitalmarkets.fanniemae.com/sustainable-bonds/social-bonds, Link to https://capitalmarkets.fanniemae.com/, Link to http://capitalmarkets.fanniemae.com, Link to https://capitalmarkets.fanniemae.com/sustainable-bonds/green-bonds",
Farm Credit Administration (FCA),https://www.fca.gov/,Link to /farmer-mac-oversight/risk-based-capital-stress-test,
Farm Credit System Insurance Corporation (FCSIC),https://www.fcsic.gov/,,
Farm Service Agency (FSA),https://www.fsa.usda.gov/,,https://dts.fsa.usda.gov/feeds/rss/fsa.usda.gov/news-releases/www.fsa.usda.gov/
